{
  "$schema": "https://json-schema.org/draft/2020-12/schema",
  "$id": "aifence://schemas/benchmark_case.schema.json",
  "title": "AIFENCE Benchmark Case",
  "type": "object",
  "required": [
    "id",
    "category",
    "title",
    "prompt",
    "artifact_contracts"
  ],
  "properties": {
    "id": {
      "type": "string"
    },
    "category": {
      "type": "string"
    },
    "title": {
      "type": "string"
    },
    "prompt": {
      "type": "string"
    },
    "artifact_contracts": {
      "type": "array",
      "items": {
        "type": "string"
      },
      "minItems": 1
    },
    "evaluation_emphasis": {
      "type": "array",
      "items": {
        "type": "string"
      }
    }
  },
  "additionalProperties": false
}
